{
  "schemaVersion": "2.0",
  "waveId": "CONTABILIDADE_FAST_LANE_WAVE_011",
  "state": "CONSUMED",
  "baseline": {
    "branch": "main",
    "commit": "3ca4bcfd60d8ddaa515bf526196833dccacf5e35"
  },
  "owners": [
    {
      "item": "FIX-TECH-AUTH-001",
      "owner": "TECHNICAL_AUTHORIZATION_ERROR_MAPPING",
      "locks": [
        "LOCK-DATA-001",
        "LOCK-EVID-001",
        "LOCK-TEST-001"
      ],
      "migration": false,
      "resultPath": "docs/implementacao/FIX_TECH_AUTH_001_RESULT.md",
      "dispatchKey": "28655a78ae9fa45c437950e19ae23e7e2c4f93ae006ad2a45ef7c61e18ce4dd1"
    },
    {
      "item": "STR-ARCH-BE-005",
      "owner": "DOCUMENTO_EMPRESA_QUERY_BOUNDARY",
      "locks": [
        "LOCK-EVID-001",
        "LOCK-TEST-001"
      ],
      "migration": false,
      "resultPath": "docs/implementacao/STR_ARCH_BE_005_RESULT.md",
      "dispatchKey": "327a42bf34a0da6f1650a9915c6ff16ccdc947743782f5c047275ce8ba6c0ab0"
    },
    {
      "item": "STR-SEC-003",
      "owner": "SECRET_LIFECYCLE_GUARD",
      "locks": [
        "LOCK-DATA-001",
        "LOCK-ENV-001",
        "LOCK-EVID-001",
        "LOCK-TEST-001"
      ],
      "migration": false,
      "resultPath": "docs/implementacao/STR_SEC_003_RESULT.md",
      "dispatchKey": "7fb06fa359a7a3fee86cddd09c6a445affa1ac8cecf1cbbe19ba5226fc65bfaf"
    },
    {
      "item": "STR-REL-003",
      "owner": "IMMUTABLE_RELEASE_PROMOTION_GUARD",
      "locks": [
        "LOCK-DEP-001",
        "LOCK-GIT-001",
        "LOCK-EVID-001",
        "LOCK-TEST-001"
      ],
      "migration": false,
      "resultPath": "docs/implementacao/STR_REL_003_RESULT.md",
      "dispatchKey": "2cac5e42f9328b66b2db2ac9d36158266acb67852ab034fb3bd5b1dadc1fca7b"
    },
    {
      "item": "STR-OPS-002",
      "owner": "RECOVERY_REHEARSAL_HARNESS",
      "locks": [
        "LOCK-DATA-001",
        "LOCK-ENV-001",
        "LOCK-EVID-001",
        "LOCK-TEST-001"
      ],
      "migration": false,
      "resultPath": "docs/implementacao/STR_OPS_002_RESULT.md",
      "dispatchKey": "c626df955edd0b82404f2f95cbb8de8d42d124aea37d2f2fdab703c3194de3f1"
    }
  ],
  "previousManifest": "docs/orquestracao/waves/released/CONTABILIDADE_FAST_LANE_WAVE_011.json"
}
