{
  "schemaVersion": "2.0",
  "waveId": "CONTABILIDADE_DOCKER_COMPOSE_RUNTIME_VALIDATION_WAVE_014",
  "state": "RELEASED_FOR_EXECUTION",
  "baseline": {
    "branch": "codex/bootstrap-deepseek-runner",
    "commit": "4098068daa809b547944e9d47f010000356da7e8"
  },
  "owners": [
    {
      "item": "VAL-P0-CONTABILIDADE-DOCKER-COMPOSE-RUNTIME-001",
      "owner": "DOCKER_COMPOSE_CLOUD_RUNTIME_VALIDATION_SERIAL",
      "locks": [
        "LOCK-STARTUP-001",
        "LOCK-ENV-001",
        "LOCK-DATA-001",
        "LOCK-EXT-001",
        "LOCK-EVID-001",
        "LOCK-TEST-001",
        "LOCK-GIT-001"
      ],
      "migration": false,
      "resultPath": "docs/implementacao/VAL_P0_CONTABILIDADE_DOCKER_COMPOSE_RUNTIME_001_RESULT.md",
      "dispatchKey": "5145943ba86319ae4f5b5244d417cb5d4987d601d6c09db5a9e43dbfb9a6d184"
    }
  ],
  "launcherPath": "docs/orquestracao/waves/released/CONTABILIDADE_DOCKER_COMPOSE_RUNTIME_VALIDATION_WAVE_014_LAUNCHERS.txt",
  "previousManifest": "docs/orquestracao/waves/prepared/CONTABILIDADE_DOCKER_COMPOSE_RUNTIME_VALIDATION_WAVE_014.json"
}
