{
  "schemaVersion": "2.0",
  "waveId": "CONTABILIDADE_DOCKER_COMPOSE_RUNTIME_BOOTSTRAP_WAVE_015",
  "state": "RELEASED_FOR_EXECUTION",
  "baseline": {
    "branch": "codex/bootstrap-deepseek-runner",
    "commit": "9ead0c44481d643daa7a90bd8ca6d58d32045d25"
  },
  "owners": [
    {
      "item": "VAL-P0-CONTABILIDADE-DOCKER-COMPOSE-RUNTIME-002",
      "owner": "DOCKER_COMPOSE_CLOUD_SOURCE_BOOTSTRAP_RUNTIME_VALIDATION_SERIAL",
      "locks": [
        "LOCK-STARTUP-001",
        "LOCK-ENV-001",
        "LOCK-DATA-001",
        "LOCK-EXT-001",
        "LOCK-EVID-001",
        "LOCK-TEST-001",
        "LOCK-GIT-001"
      ],
      "migration": false,
      "resultPath": "docs/implementacao/VAL_P0_CONTABILIDADE_DOCKER_COMPOSE_RUNTIME_002_RESULT.md",
      "dispatchKey": "1754f0ec557b48412403532f23ef51ba9f3950124cad081ee3c5d0ad9e9a2d8c"
    }
  ],
  "launcherPath": "docs/orquestracao/waves/released/CONTABILIDADE_DOCKER_COMPOSE_RUNTIME_BOOTSTRAP_WAVE_015_LAUNCHERS.txt",
  "previousManifest": "docs/orquestracao/waves/prepared/CONTABILIDADE_DOCKER_COMPOSE_RUNTIME_BOOTSTRAP_WAVE_015.json"
}
